{
  "schemaVersion": 1,
  "model": "de442s-mean-sphere-eclipse-candidates-v1",
  "id": "2030-2035",
  "coverage": {
    "startYear": 2030,
    "endYear": 2035,
    "endIsExclusive": true,
    "timeScale": "TDB"
  },
  "events": [
    {
      "id": "lo-20300101-hr5953",
      "kind": "lunar-occultation",
      "classificationHint": "occultation",
      "maximumJulianDateTdb": 2462502.813993619,
      "maximumIsoTdb": "2030-01-01T07:32:09.048 TDB",
      "searchStartJulianDateTdb": 2462502.063993619,
      "searchEndJulianDateTdb": 2462503.563993619,
      "centerSeparationRadians": 0.000634734566,
      "candidateLimitRadians": 0.022858241767,
      "clearanceRadians": 0.022223507201,
      "target": {
        "catalog": "BSC5P",
        "hr": 5953,
        "hd": 143275,
        "label": "7Del Sco",
        "labelJa": null,
        "vMagnitude": 2.32
      }
    },
    {
      "id": "lo-20300104-hr7264",
      "kind": "lunar-occultation",
      "classificationHint": "occultation",
      "maximumJulianDateTdb": 2462505.818079356,
      "maximumIsoTdb": "2030-01-04T07:38:02.056 TDB",
      "searchStartJulianDateTdb": 2462505.068079356,
      "searchEndJulianDateTdb": 2462506.568079356,
      "centerSeparationRadians": 0.008193965543,
      "candidateLimitRadians": 0.022566688267,
      "clearanceRadians": 0.014372722723,
      "target": {
        "catalog": "BSC5P",
        "hr": 7264,
        "hd": 178524,
        "label": "41Pi Sgr",
        "labelJa": null,
        "vMagnitude": 2.89
      }
    },
    {
      "id": "lo-20300117-hr2286",
      "kind": "lunar-occultation",
      "classificationHint": "occultation",
      "maximumJulianDateTdb": 2462519.284861905,
      "maximumIsoTdb": "2030-01-17T18:50:12.068 TDB",
      "searchStartJulianDateTdb": 2462518.534861905,
      "searchEndJulianDateTdb": 2462520.034861905,
      "centerSeparationRadians": 0.002195305788,
      "candidateLimitRadians": 0.021133865783,
      "clearanceRadians": 0.018938559995,
      "target": {
        "catalog": "BSC5P",
        "hr": 2286,
        "hd": 44478,
        "label": "13Mu Gem",
        "labelJa": null,
        "vMagnitude": 2.88
      }
    },
    {
      "id": "lo-20300128-hr5953",
      "kind": "lunar-occultation",
      "classificationHint": "occultation",
      "maximumJulianDateTdb": 2462530.109062064,
      "maximumIsoTdb": "2030-01-28T14:37:02.962 TDB",
      "searchStartJulianDateTdb": 2462529.359062064,
      "searchEndJulianDateTdb": 2462530.859062064,
      "centerSeparationRadians": 0.001237802871,
      "candidateLimitRadians": 0.02254348485,
      "clearanceRadians": 0.021305681978,
      "target": {
        "catalog": "BSC5P",
        "hr": 5953,
        "hd": 143275,
        "label": "7Del Sco",
        "labelJa": null,
        "vMagnitude": 2.32
      }
    },
    {
      "id": "lo-20300131-hr7264",
      "kind": "lunar-occultation",
      "classificationHint": "occultation",
      "maximumJulianDateTdb": 2462533.201512848,
      "maximumIsoTdb": "2030-01-31T16:50:10.710 TDB",
      "searchStartJulianDateTdb": 2462532.451512848,
      "searchEndJulianDateTdb": 2462533.951512848,
      "centerSeparationRadians": 0.008596840581,
      "candidateLimitRadians": 0.022342862336,
      "clearanceRadians": 0.013746021755,
      "target": {
        "catalog": "BSC5P",
        "hr": 7264,
        "hd": 178524,
        "label": "41Pi Sgr",
        "labelJa": null,
        "vMagnitude": 2.89
      }
    },
    {
      "id": "lo-20300214-hr2286",
      "kind": "lunar-occultation",
      "classificationHint": "occultation",
      "maximumJulianDateTdb": 2462546.650545044,
      "maximumIsoTdb": "2030-02-14T03:36:47.091 TDB",
      "searchStartJulianDateTdb": 2462545.900545044,
      "searchEndJulianDateTdb": 2462547.400545044,
      "centerSeparationRadians": 0.004291206784,
      "candidateLimitRadians": 0.021122227609,
      "clearanceRadians": 0.016831020824,
      "target": {
        "catalog": "BSC5P",
        "hr": 2286,
        "hd": 44478,
        "label": "13Mu Gem",
        "labelJa": null,
        "vMagnitude": 2.88
      }
    },
    {
      "id": "lo-20300224-hr5953",
      "kind": "lunar-occultation",
      "classificationHint": "occultation",
      "maximumJulianDateTdb": 2462557.331597641,
      "maximumIsoTdb": "2030-02-24T19:57:30.036 TDB",
      "searchStartJulianDateTdb": 2462556.581597641,
      "searchEndJulianDateTdb": 2462558.081597641,
      "centerSeparationRadians": 0.00522125971,
      "candidateLimitRadians": 0.022494541555,
      "clearanceRadians": 0.017273281845,
      "target": {
        "catalog": "BSC5P",
        "hr": 5953,
        "hd": 143275,
        "label": "7Del Sco",
        "labelJa": null,
        "vMagnitude": 2.32
      }
    },
    {
      "id": "lo-20300227-hr7264",
      "kind": "lunar-occultation",
      "classificationHint": "occultation",
      "maximumJulianDateTdb": 2462560.479160555,
      "maximumIsoTdb": "2030-02-27T23:29:59.471 TDB",
      "searchStartJulianDateTdb": 2462559.729160555,
      "searchEndJulianDateTdb": 2462561.229160555,
      "centerSeparationRadians": 0.011167913357,
      "candidateLimitRadians": 0.022116111528,
      "clearanceRadians": 0.01094819817,
      "target": {
        "catalog": "BSC5P",
        "hr": 7264,
        "hd": 178524,
        "label": "41Pi Sgr",
        "labelJa": null,
        "vMagnitude": 2.89
      }
    },
    {
      "id": "lo-20300313-hr2286",
      "kind": "lunar-occultation",
      "classificationHint": "occultation",
      "maximumJulianDateTdb": 2462574.016464951,
      "maximumIsoTdb": "2030-03-13T12:23:42.571 TDB",
      "searchStartJulianDateTdb": 2462573.266464951,
      "searchEndJulianDateTdb": 2462574.766464951,
      "centerSeparationRadians": 0.008500709029,
      "candidateLimitRadians": 0.020998547791,
      "clearanceRadians": 0.012497838763,
      "target": {
        "catalog": "BSC5P",
        "hr": 2286,
        "hd": 44478,
        "label": "13Mu Gem",
        "labelJa": null,
        "vMagnitude": 2.88
      }
    },
    {
      "id": "lo-20300324-hr5953",
      "kind": "lunar-occultation",
      "classificationHint": "occultation",
      "maximumJulianDateTdb": 2462584.588292627,
      "maximumIsoTdb": "2030-03-24T02:07:08.482 TDB",
      "searchStartJulianDateTdb": 2462583.838292627,
      "searchEndJulianDateTdb": 2462585.338292627,
      "centerSeparationRadians": 0.009654115671,
      "candidateLimitRadians": 0.022755676117,
      "clearanceRadians": 0.013101560446,
      "target": {
        "catalog": "BSC5P",
        "hr": 5953,
        "hd": 143275,
        "label": "7Del Sco",
        "labelJa": null,
        "vMagnitude": 2.32
      }
    },
    {
      "id": "lo-20300327-hr7264",
      "kind": "lunar-occultation",
      "classificationHint": "occultation",
      "maximumJulianDateTdb": 2462587.700839505,
      "maximumIsoTdb": "2030-03-27T04:49:12.533 TDB",
      "searchStartJulianDateTdb": 2462586.950839505,
      "searchEndJulianDateTdb": 2462588.450839505,
      "centerSeparationRadians": 0.015417355499,
      "candidateLimitRadians": 0.022117246716,
      "clearanceRadians": 0.006699891217,
      "target": {
        "catalog": "BSC5P",
        "hr": 7264,
        "hd": 178524,
        "label": "41Pi Sgr",
        "labelJa": null,
        "vMagnitude": 2.89
      }
    },
    {
      "id": "lo-20300409-hr2286",
      "kind": "lunar-occultation",
      "classificationHint": "occultation",
      "maximumJulianDateTdb": 2462601.340228532,
      "maximumIsoTdb": "2030-04-09T20:09:55.745 TDB",
      "searchStartJulianDateTdb": 2462600.590228532,
      "searchEndJulianDateTdb": 2462602.090228532,
      "centerSeparationRadians": 0.012998967274,
      "candidateLimitRadians": 0.020837831328,
      "clearanceRadians": 0.007838864054,
      "target": {
        "catalog": "BSC5P",
        "hr": 2286,
        "hd": 44478,
        "label": "13Mu Gem",
        "labelJa": null,
        "vMagnitude": 2.88
      }
    },
    {
      "id": "lo-20300420-hr5953",
      "kind": "lunar-occultation",
      "classificationHint": "occultation",
      "maximumJulianDateTdb": 2462611.946557857,
      "maximumIsoTdb": "2030-04-20T10:43:02.598 TDB",
      "searchStartJulianDateTdb": 2462611.196557857,
      "searchEndJulianDateTdb": 2462612.696557857,
      "centerSeparationRadians": 0.012563665855,
      "candidateLimitRadians": 0.023114612724,
      "clearanceRadians": 0.01055094687,
      "target": {
        "catalog": "BSC5P",
        "hr": 5953,
        "hd": 143275,
        "label": "7Del Sco",
        "labelJa": null,
        "vMagnitude": 2.32
      }
    },
    {
      "id": "lo-20300423-hr7264",
      "kind": "lunar-occultation",
      "classificationHint": "occultation",
      "maximumJulianDateTdb": 2462614.961206491,
      "maximumIsoTdb": "2030-04-23T11:04:08.240 TDB",
      "searchStartJulianDateTdb": 2462614.211206491,
      "searchEndJulianDateTdb": 2462615.711206491,
      "centerSeparationRadians": 0.019402318318,
      "candidateLimitRadians": 0.022381251779,
      "clearanceRadians": 0.002978933461,
      "target": {
        "catalog": "BSC5P",
        "hr": 7264,
        "hd": 178524,
        "label": "41Pi Sgr",
        "labelJa": null,
        "vMagnitude": 2.89
      }
    },
    {
      "id": "lo-20300507-hr2286",
      "kind": "lunar-occultation",
      "classificationHint": "occultation",
      "maximumJulianDateTdb": 2462628.612501198,
      "maximumIsoTdb": "2030-05-07T02:42:00.103 TDB",
      "searchStartJulianDateTdb": 2462627.862501198,
      "searchEndJulianDateTdb": 2462629.362501198,
      "centerSeparationRadians": 0.015812796403,
      "candidateLimitRadians": 0.020727698704,
      "clearanceRadians": 0.004914902301,
      "target": {
        "catalog": "BSC5P",
        "hr": 2286,
        "hd": 44478,
        "label": "13Mu Gem",
        "labelJa": null,
        "vMagnitude": 2.88
      }
    },
    {
      "id": "lo-20300517-hr5953",